A1: Building Technology 2
A2: National Module ABC 089
A3: SIN 27754
A4: Delivery Schedule
A5: Week | B5: Date | C5: Lesson Content
A6: 1 | B6: 39650 | C6: Introduction Program discussion, Project work requirements, Topic selection
A7: 2 | B7: =B6+7 -> 39657 | C7: Topic allocation, discussion of selected project & clarification of submission
A8: 3 | B8: =B7+7 -> 39664 | C8: Topic research of selected project
A9: 4 | B9: =B8+7 -> 39671 | C9: Assessment 1 Submission of your topic synopsis
A10: 5 | B10: =B9+7 -> 39678 | C10: Research (self-directed studies assignment work)
A11: 6 | B11: =B10+7 -> 39685 | C11: Research (self-directed studies assignment work)
A12: 7 | B12: =B11+7 -> 39692 | C12: Discussion of your research and progress (clarifying issues - final assignment)
A13: 8 | B13: =B12+7 -> 39699 | C13: Research (self-directed studies assignment work)
A14: 9 | B14: =B13+7 -> 39706 | C14: Research (self-directed studies assignment work)
A15: 10 | B15: =B14+7 -> 39713 | C15: Assessment 2 Submission draft-assignment Feedback on your draft submission - clarifying presentation issues
A16: TERM BREAK
A17: 11 | B17: =B15+14 -> 39727 | C17: Students contact free Week continue with your work on assignment, presentation preparation
A18: 12 | B18: =B17+7 -> 39734 | C18: Students discussion of content and structure of your final presentation
A19: 13 | B19: =B18+7 -> 39741 | C19: Research (self-directed studies) finalising assignment, presentation preparation
A20: 14 | B20: =B19+7 -> 39748 | C20: Research (self-directed studies) finalising assignment, presentation preparation
A21: 15 | B21: =B20+7 -> 39755 | C21: Assessment 3 Final assignment submission, presentation preparation
A22: 16 | B22: =B21+7 -> 39762 | C22: Assessment 4 Students project presentation (PPT), debating presentation issues (Half an hour time allowed for presenting and discussing your work)
A23: 17 | B23: =B22+7 -> 39769 | C23: Assessment 4 (cont) debating presentation issues Subject round off
A24: 18 | B24: =B23+7 -> 39776 | C24: Examinations (all examable subjects)
A25: 19 | B25: =B24+7 -> 39783 | C25: Results - Placed on board
A26: 20 | B26: =B25+7 -> 39790 | C26: End of Semester
B28: Attendance for all shaded sessions is compulsory.
A29: All dates start at the beginning of the Week (Mondays), refer to Academic Calendar for exact dates
A30: The success of the program depends very much on your commitment to participate as well as the attendance of all compulsory sessions.
A31: Program is subject to change.