A1: Builders Working Drawing 2 DELIVERY SCHEDULE
A2: Week No | B2: Learning Outcome | C2: Lesson Content | D2: References
A3: Date
A4: 1 | B4: 1, 2, 3 | C4: Introduction/ Module Requirements/ Assessment Assignment No. 1 “UPPER STOREY EXTENSION, LOT 22” handed out | D4: Text pages 6 to 57 Assign Brief
A5: 39483
A6: 2 | B6: 1, 2, 3 | C6: Working on Assignment No. 1
A7: =A5+7 -> 39490
A8: 3
A9: =A7+7 -> 39497
A10: 4
A11: =A9+7 -> 39504
A12: 5
A13: =A11+7 -> 39511
A14: 6
A15: =A13+7 -> 39518
A16: 7 | B16: 1, 2, 3 | C16: Assignment No. 1 handed in at class commencement Assignment No. 2 “BUILDING DETAILS 1 handed out.
A17: =A15+7 -> 39525
A18: 8 | B18: 1, 2, 3 | C18: Working on Assignment No. 2 Late Submission Assignment 1 (non compliance result in R-grade)
A19: =A17+7 -> 39532
A20: 9 | B20: 1, 2, 3 | C20: Working on Assignment No. 2
A21: =A19+7 -> 39539
A22: 10
A23: =A21+7 -> 39546
A24: =A23+7 -> 39553 | B24: Term Break
A25: 11 | B25: COLLEGE NON – CONTACT WEEK
A26: =A24+7 -> 39560
A27: 12 | B27: 1, 2, 3 | C27: Working on Assignment No. 2 | D27: Text pages 6 to 57 Assign Brief
A28: =A26+7 -> 39567
A29: 13 | B29: 1, 2, 3 | C29: Assignment No. 2 handed in at class commencement, Assignment No. 3 ”BUILDING DETAILS 2 handed out.
A30: =A28+7 -> 39574
A31: 14 | B31: 1, 2, 3 | C31: Working on Assignment No. 3 Late Submission Assignment 2 (non compliance result in R-grade)
A32: =A30+7 -> 39581
A33: 15 | B33: 1, 2, 3 | C33: Working on Assignment No. 3
A34: =A32+7 -> 39588
A35: 16 | B35: 1, 2, 3 | C35: Plan Reading and Drawing ASSESSMENT
A36: =A34+7 -> 39595
A37: 17 | C37: Assignment No. 3 handed in at end of class
A38: =A36+7 -> 39602
A39: 18 | C39: Last date for Re-assessment and Resubmission Assignment 3 to be handed in. Failure to do so results in a R-grade
A40: =A38+7 -> 39609
A41: 19 | C41: Marking, results displayed on 'Results' board
A42: =A40+7 -> 39616
A43: 20 | B43: 1, 2, 3 | C43: Entry of Assessments onto Reporting System
A44: =A42+7 -> 39623
A46: Program is subject to change without further notice
A47: Please note: Attendance for all session is compulsory