B1: Builders Working Drawing 2DELIVERY SCHEDULE
B2: Week No | C2: LearningOutcome | D2: Lesson Content | E2: References
B3: Date
B4: 1 | C4: 1, 2, 3 | D4: Introduction/ Module Requirements/ AssessmentAssignment No. 1 “UPPER STOREY EXTENSION, LOT 22” handed out | E4: Text pages6 to 57Assign Brief
B5: 39483
B6: 2 | C6: 1, 2, 3 | D6: Working on Assignment No. 1
B7: =B5+7 -> 39490
B8: 3
B9: =B7+7 -> 39497
B10: 4
B11: =B9+7 -> 39504
B12: 5
B13: =B11+7 -> 39511
B14: 6
B15: =B13+7 -> 39518
B16: 7 | C16: 1, 2, 3 | D16: Assignment No. 1 handed in at class commencement Assignment No. 2 “BUILDING DETAILS 1 handed out.
B17: =B15+7 -> 39525
B18: 8 | C18: 1, 2, 5 | D18: Working on Assignment No. 2Late Submission Assignment 1 (non compliance result in R-grade
B19: =B17+7 -> 39532
B20: 9 | D20: Working on Assignment No. 2
B21: =B19+7 -> 39539
B22: 10 | D22: Working on Assignment No. 2
B23: =B21+7 -> 39546
B24: =B23+7 -> 39553 | C24: Term Break
B25: 11 | C25: COLLEGE NON – CONTACT WEEK
B26: =B24+7 -> 39560
B27: 12 | C27: 1,2,3 | D27: Working on Assignment No. 2 | E27: Text pages6 to 57Assign Brief
B28: =B26+7 -> 39567
B29: 13 | D29: Assignment No. 2 handed in at class commencement, Assignment No. 3 ”BUILDING DETAILS 2 handed out.
B30: =B28+7 -> 39574
B31: 14 | C31: 1,2,3 | D31: Working on Assignment No. 3Late Submission Assignment 2 (non compliance result in R-grade
B32: =B30+7 -> 39581
B33: 15 | D33: Working on Assignment No. 3Late Submission Assignment 3 (non compliance result in R-grade
B34: =B32+7 -> 39588
B35: 16 | C35: 1,2,3 | D35: Plan Reading and Drawing ASSESSMENT
B36: =B34+7 -> 39595
B37: 17 | D37: Assignment No. 3 handed in at class commencement
B38: =B36+7 -> 39602
B39: 18 | D39: Last date for Re-assessments - Resubmissions to be handed in. Failure to do so results in a R-grade
B40: =B38+7 -> 39609
B41: 19 | D41: Marking, results displayed on 'Results' board
B42: =B40+7 -> 39616
B43: 20 | C43: 1, 2, 3 | D43: Entry of Assessments onto Reporting System
B44: =B42+7 -> 39623
B46: Program is subject to change without further notice
B47: Please note: Attendance for all session is compulsory
B48: back to Drawing contents page