B1: Assessment Plan
A2: Week | B2: Date | C2: Assessment Tasks | D2: Assessment Instructions | E2: Perform. criteria
A3: ='I:\Surveying\Surveying2\[DSAP-2-2008-SS&SO-2.xls]Timetable'!A7 -> 5 | B3: ='I:\Surveying\Surveying2\[DSAP-2-2008-SS&SO-2.xls]Timetable'!B7 -> 39678 | C3: Research various leveling devices. (Learning Resource Centre, Internet, Maufacturer brochures, etc) | D3: Assignment should cove the performance criteria as outlined in the assignment sheet. | E3: 2
A4: ='I:\Surveying\Surveying2\[DSAP-2-2008-SS&SO-2.xls]Timetable'!A10 -> 8 | B4: ='I:\Surveying\Surveying2\[DSAP-2-2008-SS&SO-2.xls]Timetable'!B10 -> 39699 | C4: Supervised Exercise 1 Chain line and offsets (ranging poles, optical square & measuring tape) | D4: Set up Chainline, take offsets and peg out rectangular building | E4: 1,3,4,5
A5: 10 | B5: ='I:\Surveying\Surveying2\[DSAP-2-2008-SS&SO-2.xls]Timetable'!B12 -> 39713 | C5: Supervised Exercise 2 Set out building and locate site features (theodolite & 50 metre tape) | D5: Pegt out rectangular building, locate site features, use polar coordinates, | E5: 1,3,4,5
A6: ='I:\Surveying\Surveying2\[DSAP-2-2008-SS&SO-2.xls]Timetable'!A17 -> 14 | B6: ='I:\Surveying\Surveying2\[DSAP-2-2008-SS&SO-2.xls]Timetable'!B17 -> 39748 | C6: Set out building without supervision. Chain line and offsets (ranging poles, optical square & measuring tape) | D6: Set up Chainline, take offsets and peg out T or L -shaped building | E6: 1,3,4,5
A7: 18 | B7: ='I:\Surveying\Surveying2\[DSAP-2-2008-SS&SO-2.xls]Timetable'!B21 -> 39776 | C7: Set out building without supervision. Set out building and locate site features (theodolite & 50 metre tape) | D7: Peg out T or L-shaped building, locate site features, use polar coordinates, | E7: 1,3,4,5
A8: Please note: There is no final theory examination. The unit is assessed by practical team work and assignments. The subject matter in the lessons is not easy to grasp and students should not miss a lesson. Great emphasis is placed on teamwork and students ability to plan activities and solving problems. Candidates will need to demonstrate competence a number of times under various conditions to satisfy the Element/Performance Criteria Under CBT and AQTF provisions candidates do not receive a percentage mark for the unit completed. Candidates demonstrating competence will receive a grade of “CO” (competent). Candidates failing to demonstrate competence at the end of an individual assessment task will receive the grade of “H” (Hold) and will be required to re-do an exercise/assignment to the required competence level. Candidates failing to demonstrate competence at the end of the unit will receive the grade of “R” (re-enrol), and will be required to re-enrol in the unit again and complete ALL assessment tasks again to the required competence level.