A1: Semester 2 - 2009 W4904 (BCGBC4018A) Apply site surveys and set out procedures to building and construction projects Course Outline, Projects & Assessment Plan This Unit is common to Building Studies courses: Diploma of Building & Construction (Building) (Code W268) Diploma of Builders Registration (Code WT71) The Unit activities will take place each week on Tuesday and Wednesday Room 1313 at 13.00 Duration of activities at each meeting is two (2) hours in Semester 2 2009.. Telephone: 92024398 E-mail: karl.boeing@central.wa.edu.au Individual Learning and Assessment Needs Central TAFE recognizes that individual learners may have individual needs that may affect participation in learning and assessment. Notify your Lecturer or Disability Support Officer if you have particular learning needs or a Disability and / or are unable to complete the assessment tasks as outlined in the Assessment Plan (see reverse side of this sheet). College services include: Independent Learning Unit (ILU), English as a Second Language (ESL), International Student Mentors, Disability Support Unit, Flexible Delivery & Online Delivery, Learning Resource Centre (LRC). Recognition of Prior Learning Skills Recognition(Contact your Lecturer or Student Services regarding Skills Recognition if you are able to demonstrate that you have already achieved the competencies of this unit or unit. Please refer to the unit Elements for full details of the performance criteria refer to the unit Curriculum Document available in the library. ) Delivery Schedule The subject matter in the lessons is not easy to grasp and students should not miss a lesson. Great emphasis is placed on how information is collected, analysed and organised. Students ability to plan activities and solving mathematical problems is a major assessment consideration. ASSESSMENT PLAN [ top of page ] Two Peg Test Collimation error occurs when the collimation axis is not truly horizontal when the instrument is level. The effect is illustrated in the sketch below: Set out and mark on the ground (with wooden pegs driven into the earth, or roofing nails in tar) two point some 40 m apart. Set up the the level exactly mid-way (within 0.5m) between them. Take measurements of backsight and foresight for this first setup. The height difference DH will be free of the effects of collimation error. Next, move the level to a position just beyond the fore staff position (about 5m). The difference between the readings of the two level positions should be zero. If more than 5 mm the instrument need to be calibrated. The instrument check can be done near the Surveying Store. Staff readings are found at the Surveying Store and at the toilet on Block G. The mitpoint is marked on the pavement (shown between G-Block and F-Block. [ top of page ] PROJECT 1 (Learning Outcomes 3,5) Setup and record the levels of each of the BLUE stations, 1 to 11 inclusive marked on the roadway in the area shown on the “Location Plan”. Take Station 1 as datum 10.000 and convert staff readings to Reduced Levels (R.L.’s), using the rise and fall method. Project 1 Location Plan Ask lecturer for details and submission dates [ top of page ] PROJECT 2 (Learning Outcomes 3,5) Setup and record the levels of each of the BLUE AND YELLOW stations, 1 to 7 marked on the roadway in the area shown on the “Location Plan”. Take Station 1 as datum 10.000 and convert staff readings to Reduced Levels (R.L.’s), using the rise and fall method. Project 2 Location Plan Ask lecturer for details and submission dates [ top of page ] PROJECT 3 (Learning Outcomes 3,5) Setup and record the levels of each of the YELLOW stations, 1 to 24 inclusive 25 (make sure you close the travers) marked on the roadway in the area shown on the “Location Plan”. Take Station 1 as datum 10.000 and convert staff readings to Reduced Levels (R.L.’s), using the rise and fall method. Project 3 Location Plan Ask lecturer for details and submission dates [ top of page ] PROJECT 4 (Learning Outcomes 2,3,4) Setup and record the levels of each of the squared grid stations, marked in the area shown on the “Location Plan”. Take Station 1 as datum derived from TBM 10.000 and convert all staff readings to Reduced Levels (R.L.’s), using the rise and fall method. Grid three (3) equal spaces between wall and six (6) spaces of five (5) metre down (28 grid points). Contours are to be at 0.2m intervals. Calculate the volume of fill from the datum at Station 1. Project 4 Location Plan Ask lecturer for details and submission dates [ top of page ] PROJECT 5 (Learning Outcomes 1,3) Set out the building, to the sizes given, in the area shown on the “SITE PLAN”. Take the datum as 10.000, to be in the position shown as “A” on the “SITE PLAN” and setup the profiles to the Reduced Level (R.L.) indicated. Check the set out against the CHECK criteria on the “SITE PLAN” sheet. Project 5 Location Plan Ask lecturer for details and submission dates I will be available during class times for assistance. If I’m not in class and you can't find me outside on the College ground I will be in the staffroom. Please knock at the door (Staff room 1303) if you want to se me. [ top of page ] Last updated 20 July 2009 <!-- Begin var days = new Array(8); days[1] = "Sunday"; days[2] = "Monday"; days[3] = "Tuesday"; days[4] = "Wednesday"; days[5] = "Thursday"; days[6] = "Friday"; days[7] = "Saturday"; var months = new Array(13); months[1] = "January"; months[2] = "February"; months[3] = "March"; months[4] = "April"; months[5] = "May"; months[6] = "June"; months[7] = "July"; months[8] = "August"; months[9] = "September"; months[10] = "October"; months[11] = "November"; months[12] = "December"; var dateObj = new Date(document.lastModified) var wday = days[dateObj.getDay() + 1] var lmonth = months[dateObj.getMonth() + 1] var date = dateObj.getDate() var fyear = dateObj.getYear() if (fyear < 2000) fyear = fyear + 1900 document.write(wday + ", " + lmonth + " " + date + ", " + fyear) // End --> Back to BSS & SO 1 home page

A1: Assessment Plan | B1: 2-peg-test | C1: Project 1 | D1: Project 2 | E1: Project 3 | F1: Project 4 | G1: Project 5

A1: Week | B1: Date | C1: Assessment Tasks | D1: Assessment Instructions | E1: Perform. criteria
A2: 14 | B2: ='D:\TAFE\SS&SO\SS&SO1\[DSAP-2-2008-SS&SO1.xls]Assessment'!$B$4 -> 39748 | C2: Project 1 Straight level | D2: Use rise & fall template for all field recordings For your final submission prepare clear and neatly written answers in ink on your project sheets, All drawings may be in pencil. | E2: 1,2,3,4
A3: 14 | B3: ='D:\TAFE\SS&SO\SS&SO1\[DSAP-2-2008-SS&SO1.xls]Assessment'!$B$4 -> 39748 | C3: Project 2 Angled line level
A4: 15 | B4: ='D:\TAFE\SS&SO\SS&SO1\[DSAP-2-2008-SS&SO1.xls]Assessment'!$B$6 -> 39755 | C4: Project 3 Closing angled line level
A5: 16 | B5: ='D:\TAFE\SS&SO\SS&SO1\[DSAP-2-2008-SS&SO1.xls]Assessment'!$B$7 -> 39762 | C5: Project 4 Grid level, contour lines & volume calculation
A6: 17 | B6: ='D:\TAFE\SS&SO\SS&SO1\[DSAP-2-2008-SS&SO1.xls]Assessment'!$B$8 -> 39769 | C6: Project 5 Set out building (Profiles at set RL)
A7: 18 | B7: ='D:\TAFE\SS&SO\SS&SO1\[DSAP-2-2008-SS&SO1.xls]Assessment'!$B$9 -> 39776 | C7: Written assessment, 2.0 hours duration. Sketches and written answers to short answer questions. | D7: Closed book Drawing equipment allowed. Written answers in ink, drawings in pencil allowed. | E7: 1,2,3,4
A8: 20 | B8: ='D:\TAFE\SS&SO\SS&SO1\[DSAP-2-2008-SS&SO1.xls]Assessment'!$B$10 -> 39790 | C8: End of Semester - Re-enrolments Please note: There is no Resit and if you do not pass the Assessment in 18 you need to re-enrol

A1: Instrument Level checking (2 Peg test) This exercise must be carried out each time before you do any leveling 1 Setup and test the Instrument ( Inst. No.________ ) 0.0m 40.0 m Difference Recording from centre spot : ________ ________ ________ Recording from -5 or 45 m spot : ________ ________ ________