A1: TIMETABLE Semester 2 - 2008 BCGBC4018A Apply site surveys and set out procedures to building and constructuion projects SIN 27744 Building Site Surveying & Set Out 1
A2: Week | B2: Date | C2: P.C. | D2: Lesson Content | E2: References
A3: 1 | B3: 39650 | C3: 1 | D3: Introduction to subject. | E3: Text Unit 1 pages 3 to 13; Notes
A4: 2 | B4: =B3+7 -> 39657 | C4: 1 | D4: Solve right triangle problems using geometry and trigonometry, Calculate squares, rectangle & triangles | E4: Text Unit 1 pages 13 to 29; Notes
A5: 3 | B5: =B4+7 -> 39664 | C5: 1 | D5: Properties of figures/Review exercises. | E5: Text Unit 1 pages 3 to 29; Notes
A6: 4 | B6: =B5+7 -> 39671 | C6: 2 | D6: Equipment for residential levelling and setout | E6: Text Units 3, 4; Notes
A7: 5 | B7: =B6+7 -> 39678 | C7: 2 | D7: Booking of levels/Sections through sites using collimation & rise & fall method | E7: Text Units 5, 7; Notes
A8: 6 | B8: =B7+7 -> 39685 | C8: 2,3,4 | D8: Sections through sites / Measurement from grid spots | E8: Text Units 6, 7; Notes
A9: 7 | B9: =B8+7 -> 39692 | C9: 3 | D9: Contours & site plans | E9: Text Unit 6; Notes
A10: 8 | B10: =B9+7 -> 39699 | C10: 3,4 | D10: Establish countours lines on site plans
A11: 9 | B11: =B10+7 -> 39706 | C11: 3,4 | D11: Calculate cut and fill
A12: 10 | B12: =B11+7 -> 39713 | C12: 3,4 | D12: More cut and fill calculations
A13: TERM BREAK
A14: 11 | B14: =B12+14 -> 39727 | C14: Student contact free Week
A15: 12 | B15: =B14+7 -> 39734 | C15: All | D15: Practical Projects 1 to 5 Students work in groups (Group consist of two students) | E15: Project Notes Text Units 5,6,7
A16: 13 | B16: =B15+7 -> 39741 | C16: All
A17: 14 | B17: =B16+7 -> 39748 | C17: All | D17: Submission of Project 1 & 2
A18: 15 | B18: =B17+7 -> 39755 | C18: All | D18: Submission of Project 3
A19: 16 | B19: =B18+7 -> 39762 | C19: All | D19: Submission of Project 4
A20: 17 | B20: =B19+7 -> 39769 | C20: All | D20: Submission of Project 5
A21: 18 | B21: =B20+7 -> 39776 | C21: All | D21: Written Assessment | E21: Text Units 1 to 6;Notes
A22: 19 | B22: =B21+7 -> 39783 | D22: Marking, Assessment and Practical Project Results displayed on 'Results' board
A23: 20 | B23: =B22+7 -> 39790 | C23: All | D23: Re-assessment of Theory or Practical if required | E23: Project Notes Text Units 1 to 7
A24: Program is subject to change without further notice
B26: Dates: Beginning of Week (Monday)
A28: All Project must be submitted on the due day. Failure to do so will result in a R-grade